{
  "schema_version": 1,
  "request_id": "request-offline-001",
  "display_text": "중요한 일정이 있구나. 너무 무리하지 말고 천천히 준비해 보자.",
  "command_candidates": [],
  "memory_candidates": [
    {
      "candidate_id": "memory-candidate-001",
      "type": "UserSharedEvent",
      "summary": "사용자가 중요한 일정을 앞두고 긴장된다고 직접 말했다.",
      "source_ids": ["message-user-001"],
      "source_mode": "Offline",
      "occurred_at": "2026-07-15T13:00:00+09:00",
      "confidence": 1.0
    }
  ],
  "metadata": {
    "provider": "mock",
    "model_version": "mock-v1",
    "prompt_version": "mock-v1"
  }
}
